ID,Title,Date,Image,Text
3174288,سرلشکر سلامی روز نیروی دریایی سپاه را تبریک گفت,۱۷ مهر ۱۴۰۳ - ۲۰:۰۸,https://newsmedia.tasnimnews.com/Tasnim/Uploaded/Image/1403/03/21/1403032109500120830261934.jpg,"به گزارش گروه سیاسیخبرگزاری تسنیم، حسین سلامی فرمانده کل سپاه طی پیامی ""روز نیروی دریایی سپاه"" را به فرمانده دریادل و دلاور این نیرو تبریک گفت. در پیام سلامی به تنگسیری آمده است : وَأَعِدُّوا لَهُم مَّا اسْتَطَعْتُم مِّن قُوَّهٍ وَمِن رِّبَاطِ الْخَیْلِ تُرْهِبُونَ بِهِ عَدُوَّ اللَّهِ وَعَدُوَّکُمْ (سوره انفال، آیه 60) ""16 مهرماه"" هر سال یادآور حماسه بزرگ  و ماندگاری است که بر تارک آن نام شهیدان والا مقام ""نادر مهدوی، بیژن گرد، نصراله شفیعی، غلامحسین توسلی، مهدی محمدیها، خداداد آبسالان و مجید مبارکی"" می‌درخشد و مسیر تاریخ سازی دلاورمردان نیروی دریایی سپاه پاسداران انقلاب اسلامی در آوردگاه‌های خطیر پیش رو به ویژه در عرصه‌های صیانت از امنیت پایدار منطقه‌ای و مقابله با تهدیدات دشمنان منطقه‌ای و امن نگه داشتن خلیج فارس و گذرگاه راهبردی تنگه هرمز و همچنین آب‌های مناطق پیرامونی برای تامین انرژی مردم جهان را روشنایی می بخشد. حماسه عظیم رویارویی دریادلان نیروی دریایی سپاه با نظامیان متجاوز رژیم جنایتکار امریکا در اوج جنگ تحمیلی در خلیج همیشه فارس به عنوان یک نقطه عطف تاریخی در دفاع مقدس 8 ساله، نمادی از مقاومت، ایستادگی، فداکاری و ایثارگری فرزندان ملت شریف و قهرمان ایران با شیطان بزرگ و جلوه ای از  روح استکبار ستیزی و دشمن شناسی ایرانیان است . امروزه نبرد دریایی که میدانی پیچیده و رمز آلوده است اگر فاقد ترکیب موزون انسان، ابزار و فناوری باشد محکوم شکست است و خدای بزرگ را شاکریم که "" نیروی دریایی مقتدر سپاه"" به یمن برخورداری از نیروی انسانی صاحب ایمان، انگیزه، شجاعت، ثبات قدم، استحکام، مقاومت جسمانی، روح بلند و قوی، هوش سرشار، ابتکار عمل، مدیریت انقلابی، خلاقیت و آماده برای آفرینش تاکتیک‌های متنوع و موفق در شرایط نامتعارف و همچنین مسلح  بودن به دانش، مهارت و توانمندی غلبه بر دشمن در صحنه جنگ در دریا از جمله نبرد سطحی، نبرد در زیر سطح، رزم موشکی، نبرد مین، عملیات از ساحل، نبرد در هوا و فضا و دفاع هوایی در مقابل تهاجمات هوایی دشمن، نبردهای موشکی، رزم تفنگ‌دارها،استفاده از سامانه‌های بی خدمه جنگ اطلاعاتی، نبردهای سایبری در جنگ‌های الکترونیک، فرماندهی و کنترل هوشمند و سایر اجزای پیکره ساختار یکپارچه دفاعی و تهاجمی دریایی، بانک قدرت بازدارنده خود را به رخ دشمنان کشیده و نویدبخش امنیت پایدار منطقه‌ای است. به روح پرفتوح شهیدان این نیروی پرافتخار در حماسه باشکوه 16 مهرماه سال 1366 که در نبردی مجاهدانه قدرت پوشالی دشمن را به قعر آب‌های نیلگون خلیج فارس رهنمون و نام خود را در تاریخ جاودانه ساختند، درود می‌فرستیم و با تبریک ""روز نیروی دریایی سپاه"" به فرمانده دریادل و دلاور این نیرو و سایر فرماندهان کارکنان و رزمندگان غیرتمند آن ، دوام توفیق یکایک عزیزان در اجرای ماموریت‌های خطیر محوله تحت عنایات حضرت ولیعصر (عج) و تدابیر، فرامین و رهنمودهای حکیمانه مقام عظمای ولایت و رهبری و فرماندهی کل قوا حضرت امام خامنه‌ای  را از درگاه خداوند قادر متعال طلب می‌کنم. سرلشکر پاسدار حسین سلامی انتهای پیام/"
3173895,فرماندهان نیروهای دریایی ارتش و سپاه دیدار کردند,۱۷ مهر ۱۴۰۳ - ۱۱:۴۶,https://newsmedia.tasnimnews.com/Tasnim/Uploaded/Image/1403/07/17/1403071711252074031157884.jpeg,به گزارش گروه دفاعیخبرگزاری تسنیم، همزمان با فرارسیدن ١6 مهرماه روز نیروی دریایی سپاه، امیر دریادار «شهرام ایرانی» فرمانده نیروی دریایی ارتش جمهوری اسلامی ایران به همراه تعدادی از معاونان این نیرو، با سردار دریادار «علیرضا تنگسیری» فرمانده نیروی دریایی سپاه پاسداران انقلاب اسلامی دیدار و گفت‌وگو کرد. در این دیدار، یاد و خاطره شهدا و ایثارگران، به‌ویژه شهید «نادر مهدوی» و یارانش که در مواجهه جانانه و مستقیم با نیرو‌های آمریکایی در سال ١٣66 در خلیج فارس به شهادت رسیدند، گرامی داشته شد.  انتهای پیام/
3173714,ویترین تسنیم شماره ۷۵۷,۱۷ مهر ۱۴۰۳ - ۰۸:۵۸,https://newsmedia.tasnimnews.com/Tasnim/Uploaded/Image/1403/09/19/1403091915023731531642273.png,حملات موشکی کوبنده حزب الله به عمق حیفا، طبق معادله «چشم در برابر چشم» انجام شد که مقامات حزب الله و در راس آن شهید سید حسن نصرالله بارها بر آن تاکید و اعلام کرده بودند، اگر دشمن به غیرنظامیان لبنانی تجاوز کند، مقاومت همه خطوط قرمز را کنار می گذارد. هر روز بخشی از مهمتریناخبارو گزارش‌های تسنیم را در ویترین تسنیم ببینید: 1- راهبردی حزب‌الله در حمله به حیفا؛ آتش در برابر آتش 2- اختصاصی|سفیر آفریقای جنوبی از نسل کشی صهیونیست‌ها می‌گوید 3- الماس حزب‌الله در کمین اسرائیل|نگاهی به جنگ زمینی در لبنان 4- پیامدهای طوفان الاقصی برای احزاب رژیم صهیونیستی چه بود؟ 5- 10طرح عملیاتی ایران برای «پاسخ سخت» به اقدام احتمالی اسرائیل  انتهای پیام/
3173125,«رضوان» سد محکم حزب‌الله در جنوب|نگاهی به جنگ زمینی در لبنان‌ـ‌‌‌۲,۱۷ مهر ۱۴۰۳ - ۰۸:۳۱,https://newsmedia.tasnimnews.com/Tasnim/Uploaded/Image/1403/07/16/1403071614032263031152334.jpg,گروه دفاعیخبرگزاری تسنیم،سیدمحمد طاهری: حدود یک هفته است که اسرائیل جنگ زمینی با حزب‌الله را با هدف بازگرداندن امنیت به مناطق شمالی فلسطین اشغالی آغاز کرده است اما هنوز نتوانسته است توفیقی در این زمینه کسب کند. علی‌رغم اینکه اسرائیل از توان هوایی قدرتمندی برخوردار است اما تجربه نشان داده است سرنوشت همه جنگ‌ها روی زمین مشخص می‌شوند و در این زمینه از سال 2000 به این سو حزب‌الله به‌خوبی توانسته است در جبهه نبرد زمینی بر اسرائیل پیروز شود. شواهد میدانی نیز نشان می‌دهد تا کنون دست برتر در نبرد زمینی در اختیار حزب‌الله بوده است و اسرائیل قادر نبوده به هیچ یک از اهداف خود دست پیدا کند. گروه دفاعی تسنیم در نظر دارد در سلسله گزارشی به توانمندی‌های حزب‌الله در حوزه نبرد زمینی با رژیم صهیونیستی بپردازد، در اولین قسمت از این گزارش‌ها به بررسی توان «ضدزره» حزب‌الله  پرداخته شد و در قسمت دوم به معرفی یگان «رضوان» می‌پردازیم:  شاید برای اولین مرتبه پس از انتشار ویدئو‌هایی از تمرین رزم در برف و نفوذ به منطقه الجلیل بود که نام یگان «رضوان» بر سر زبان‌ها افتاد و در ادامه انتشار تصاویری از تمرین‌ رزمندگان این یگان بر شهرت آن افزود. آرم یگان رضوان از همان ابتدا تنوع تجهیزات پیشرفته، نوع پوشش و مهارت رزمندگان یگان رضوان توجه‌ها را به خود جلب کرد و سؤالات زیادی را در رابطه با این یگان و مأموریت آن ایجاد کرد. آنچه تا کنون درباره این یگان منتشر شده است نشان می‌دهد سابقه تشکیل چنین یگانی به سال 2006  برمی‌گردد. در سال 2006 حزب‌الله یگانی با نام مداخله سریع برای اجرای عملیات‌های ویژه تأسیس می‌کند و اولین مأموریت آن نیز به اسارت گرفتن نیروهای اسرائیلی در مرز با لبنان بود که منجر به جنگ 33روزه شد. در سال 2008 و پس از شهادتحاج عماد مغنیهاین یگان به نام «رضوان» تغییر نام می‌دهد. نقشه منتشرشده توسط اسرائیل از طرح یگان رضوان برای تصرف الجلیل این یگان در حقیقت به‌منظور اجرای عملیات‌های ویژه و به‌خصوص نفوذ به مناطق شمالی سرزمینهای اشغالی و تصرف منطقه الجلیل تشکیل شده است. ارتش رژیم صهیونیستی نیز در سال 2018 و در گزارشی تأکید کرده بود که حزب‌الله یگان عملیات ویژه‌ای را برای تصرف منطقه الجلیل توسعه داده است. حزب‌الله لبنان دکترین نبرد ناهمتراز را مقابل رژیم صهیونیستی در پیش گرفته است و در این دکترین یگان‌های عملیات ویژه نقش قابل‌توجهی دارند. آنچه در تعریف کلاسیک نیروهای عملیات ویژه عنوان می‌شود آن است که این نیروها باید توانایی جذب، آموزش، سازماندهی نیروی انسانی و همچنین طراحی و اجرای عملیات را داشته‌ باشند، اما ممکن است هر کشوری متناسب با سطح تهدیدات و مأموریتی که برای نیروهای مسلح خود در نظر می‌گیرد تعریف خاصی از نیروهای عملیات ویژه داشته باشد. یگان‌های عملیات ویژه با بهره‌گیری از نیروهای زبده و آموزش‌دیده و تشکیل تیم‌های کوچک و چابک عملیاتی که قادر به تصمیم‌گیری مستقل در صورت قطع ارتباط با رده‌های فرماندهی هستند،‌ قادر به نفوذ به منطقه دشمن به‌منظور تصرف و یا ضربه زدن به مناطق حساس و حیاتی دشمن هستند،این دقیقاً همان مأموریتی است که یگان رضوان در حزب‌الله لبنان نیز به‌عنوان یک یگان عملیات ویژه به‌عهده دارد و در کشورمان نیز یگان‌هایی مانند تیپ نیروهای ویژه صابرین نیروی زمینی سپاه پاسداران انقلاب اسلامی آن را به‌عهده داشته و در رزمایش‌های مختلف آن را تمرین کرده‌اند. به‌نظر می‌رسد یگان‌ رضوان در حوزه رزمی دارای تیم‌های عملیاتی کوچک با حدود 10 نفر نیرو باشد. این نیروها علاوه بر گذراندن آموزش‌های متنوع و کسب مهارت در حوزه‌های مختلف طراحی و اجرای عملیات‌های ویژه و کسب آمادگی جسمی و روانی مناسب، از تجهیزات بِروز و پیشرفته‌ای در حوزه رزم زمینی و عملیات ویژه نیز برخوردار هستند. نمونه یکی از تیم‌های عملیاتی یگان رضوان گفته می‌شود یگان رضوان در جریان نبرد با تروریست‌های تکفیری در سوریه و عراق نیز حضور داشته است و تجربیات ارزشمندی از نبرد با تکفیری‌ها کسب کرده است. یکی از دلایلی که اسرائیل اصرار دارد حزب‌الله به پشت رود لیتانی عقب‌نشینی کند ترس از عملیات یگان رضوان و نفوذ آن به منطقه شمالی فلسطین اشغالی است. رژیم صهیونیستی با اشراف به توانمندی‌های این یگان بیم آن را دارد که واقعه‌ای مانند عملیات طوفان الاقصی که توسط حماس اجرا شد توسط یگان رضوان در منطقه الجلیل رخ دهد؛ از همین روی اصرار دارد حزب‌الله به‌فاصله 20 تا 30 کیلومتری با مرز فلسطین اشغالی عقب‌نشینی کند تا دیگر قادر به نفوذ به شهرک‌های صهیونیست‌نشین و پایگاه‌های ارتش این رژیم نشود. . تمرین یگان رضوان برای ورود به منطقه الجلیل از آغاز عملیات طوفان الاقصی تاکنون رزمندگان یگان رضوان هم در معرکه نبرد با رژیم صهیونیستی حضوری فعال داشته‌اند و توانسته‌اند ضربات قابل‌توجهی به یگان‌های رژیم صهیونیستی وارد کنند، در مرحله نبرد زمینی نیز به‌نظر می‌رسد رزمندگان این یگان مانع از نفوذ صهیونیست‌ها به مناطق جنوب لبنان شده‌اند و در این مسیر هم شهدای زیادی تقدیم کرده‌اند، از جمله مهمترین این شهدا شهید وسام طویل فرمانده این یگان بود که در جریان حمله پهپادی رژیم صهیونیستی به خودروی حامل وی به شهادت رسید. برخی از مسئولان یگان رضوان که همراه ابراهیم عقیل به شهادت رسیدند پس از آن شهید ابراهیم عقیل به‌همراه جمعی از مسئولان این یگان در جریان حمله جنگنده‌های رژیم صهیونیستی به ساختمانی در منطقه ضاحیه بیروت به شهادت رسیدند. حال به‌نظر می‌رسد یگان رضوان حزب‌الله پس از سال‌ها از تشکیل آن به سطحی از بلوغ و توانمندی رسیده است که به‌عنوان یک تهدید جدی و عملی برای رژیم صهیونیستی مطرح است. این تهدید تا جایی قوی بوده است که صهیونیست‌ها از مقابله با آن عاجز شده و خواستار عقب‌نشینی حزب‌الله از منطقه جنوب لبنان هستند، همین موضوع نشان می‌دهد مسیری که برای تشکیل و تقویت این یگان پیموده شده،‌ صحیح بوده و رفته رفته رضوان را به یگانی قدرتمند در مقابل اسرائیل بدل کرده است. انتهای پیام/+
3173519,۱۰طرح عملیاتی ایران برای «پاسخ سخت» به اقدام احتمالی اسرائیل,۱۶ مهر ۱۴۰۳ - ۱۶:۳۸,https://newsmedia.tasnimnews.com/Tasnim/Uploaded/Image/1403/07/15/1403071512481513731143954.jpg,منابع مطلع نظامی به خبرنگار دفاعیخبرگزاری تسنیمگفتند که واحدهای طراحی نیروهای مسلح حداقل 10 طرح عملیاتی  متناسب برای پاسخ به اقدام احتمالی رژیم صهیونیستی آماده کرده‌اند که در صورت لزوم از آنها استفاده خواهد شد. این منابع با تاکید بر اینکه این سناریوها قابلیت به روز رسانی دارند و آماده شدن آنها نشانه جدیت ایران در پاسخ است، افزودند: پاسخ ایران ضرورتاً مقابله به مثل و در حد همان اقدام صهیونیستها نخواهد بود، بلکه می‌تواند شدیدتر و به اهداف متفاوتی باشد که اثرگذاری پاسخ را تقویت کند. این منابع نظامی می‌گویند: رژیم صهیونیستی به نسبت ایران جغرافیای بسیار محدودتر و زیرساختهای حساس‌تر و‌کمتری دارد و اقدام ایران می‌تواند رژیم را دچار مشکلات بی سابقه کند. به گفته این منابع، کشورهای بسیاری به ایران اعلام کرده‌اند که هیچ مشارکتی به نفع اسراییل نخواهند داشت، اما در هر صورت، هر کشوری به صهیونیستها در اقدام احتمالی کمک کند، از خط قرمز ایران عبور کرده و خسارت خواهد دید. انتهای پیام/
3173282,روایتی تصویری از پاکسازی تکفیری‌ها در «آخرین نبرد؛ در عراق»,۱۶ مهر ۱۴۰۳ - ۱۴:۱۶,https://newsmedia.tasnimnews.com/Tasnim/Uploaded/Image/1403/07/16/1403071614140510031152394.jpg,"به گزارش گروه دفاعیخبرگزاری تسنیم، نمایشگاه عکس «آخرین نبرد؛ در عراق» که توسط حسین ولایتی از آخرین عملیاتهای پاکسازی تکفیری‌ها  در کشور عراق به ثبت رسیده، چهارشنبه 18 مهر‌ماه از ساعت 17 در گالری شماره یک خانه عکاسان ایران افتتاح می‌شود. این نمایشگاه روایتی از آخرین عملیات‌های پاکسازی تکفیری‌ها در کشور عراق است که در نقاط مختلف این کشور از فلوجه، موصل، حویجه و تل‌عفر توسط ولایتی در سال‌های 1395 و 1396 عکاسی شده‌اند. نمایشگاه عکس  «آخرین نبرد؛ در عراق»  شامل 33 عکس در  خیابان سمیه، نرسیده به پل حافظ، حوزه هنری، گالری شماره یک خانه عکاسان ایران در معرض دید عموم قرار می‌گیرد.  حسین ولایتی عکاس این نمایشگاه در خصوص تصاویر ثبت شده می‌گوید: عراق همیشه برای من، کشوری آشنا بود، از کودکی اسم آن را، بارها به بهانه‌های مختلف شنیده بودم. مرور حوادث جنگ ایران و عراق، یادبودهای شهدای دفاع مقدس، خاطرات خانواده از کردستان ایران در زمان جنگ، متولد شدنم در زنجان به خاطرات شرایط بد کردستان، حمله آمریکا به عراق، سقوط صدام حسین؛ رفت و آمد زائران به شهرهای کربلا، نجف، کاظمین و سامرا بارها و بارها اسم عراق را برایم مطرح کرده بود. وی ادامه داد: اولین بار در سال 1392 برای زیارت اربعین به این کشور سفر کردم. سفر سخت و زمینی تا مرز مهران و بعد تشرف به نجف، پیاده تا کربلا سفری که مقارن با پیدایش نیروهای داعش بود و سپس خبرها حاکی از سقوط شهرهای عراق یکی پس از دیگری بود. فیلم‌ها و تصاویر این وقایع را دنبال می‌کردم. اینکه با اسم اسلام و با شعار الله اکبر و محمد رسول الله(ص) دست به کشتار بی گناهان می زدند برایم بسیار عجیب بود. تمام تلاش خودم را برای ارتباط با نیروهای نظامی به کار بردم و بالاخره به واسطه یکی از دوستان مستند ساز توانستم به عنوان عکاس به عراق بروم، در این سفر با همراه شهید حاج جواد حسناویی فرمانده یکی از گروهانهای سرایا الخراسانی همراه بودم. این عکاس تصریح کرد: سفر من به صورت ناتمام و با غم بسیار به پایان رسید، سفری که مفاهیم اولیه جنگ را یادم داد. جاده‌های نا امن خاکی, تله‌های انفجاری, از دست دادن دوست، خشونت جنگ، محاصره، صدای تیر، کم خوابیدن، حضور دشمن در نزدیک‌ترین حالت، انفجار، ماشین انتحاری، محاصره، نجات جان خودم و در کنار همه‌ی اینها، تلاش برای خوب عکاسی کردن. ولایتی افزود: بعد از آن راه خودم را پیدا کردم و بارها توانستم به این کشور سفر کنم. تکریت، گرمه، فلوجه، کوه‌های مکحول، بیایانهای شمال موصل، تلعفر، موصل، الحویجه، کوه‌های حقول العاس، ...  هر سفر برای من پر از خاطره بود، دوستهای جدید، اتفاقات خوب و بد و تجربه‌هایی که بسیار گران به دست آوردم. تا جایی که مقدور بود و اجازه عکاسی داشتم سعی کردم از موقعیتی در آن قرار داشتم به بهترین نحو ممکن عکاسی کنم. چیزی که در نظرم خیلی عجیب و جالب آمد این بود که هر دو طرف این جنگ با اسم اسلام و با شعارهای االله اکبر و محمد رسول الله، قبله مشترک و دین مشترک با هم می جنگیدند. اما خدا در قرآن نوید پیروزی اهل ایمان و تقوا داده است. می‌شود گفت که این پیروزی خود گواهی بود برای شناخت اسلام واقعی و مشرکان جنایتکار تکفیری  تمام تلاش خود را کردند که چهره اسلام را در دنیا مخدوش کنند ولی پیروزی مسامانان راستین نشان داد که اسلام واقعی و غیرقابل تغییر چیست. این عکاس حوزه جنگ گفت: من هم مثل دانه شنی بسیار کوچک در ساحل این دریای پر تلاطم بودم، تمام تلاشم را کردم که بتوانم واقعیت را نشان دهم و روایت خودم را از این موضوع به نمایش بگذارم. حالا افسوس‌های بسیاری در ذهن دارم چرا کم حضور داشتم؟ چرا امکان این را نداشتم که بتوانم بیشتر با عکس هایم در این زمینه روشنگری کنم؟ اما چه کنم که توانم به همین میزان بود . امید دارم به خدا که به من لطف بیشتری کند. احساس می‌کنم عراق آشناتر از این حرف‌هاست و روزی باید گمشده خودم در این کشور بیابم. انتهای پیام/"
