ID,Title,Date,Image,Text
3168548,سردار پاکپور شهادت نصرالله و سردار نیلفروشان را تسلیت گفت,۰۹ مهر ۱۴۰۳ - ۱۱:۱۳,https://newsmedia.tasnimnews.com/Tasnim/Uploaded/Image/1400/04/22/1400042215482343123192092.jpg,به گزارش گروه دفاعیخبرگزاری تسنیم،‌ سردار محمد پاکپور فرمانده نیروی زمینی سپاه در پیام‌هایی شهادت سید حسن نصرالله دبیرکل حزب‌الله لبنان و سردار عباس نیلفروشان مستشار ارشد سپاه در لبنان را تسلیت گفت. متن پیام سردار پاکپور برای سردار نیلفروشان به شرح زیر است: شهادت پرافتخار فرمانده شجاع و جانباز سرافراز و پیشکسوت دوران دفاع مقدّس و مجاهد خستگی ناپذیر عرصه های مختلف دفاع و مبارزه با قدرت های استکباری و ایادی و دست نشاندگان آنان، سردار سرتیپ پاسدار شهید، برادر عباس نیلفروشان را در حین انجام مأموریت مستشاری در لبنان و محور مقاومت توسط دژخیمان ددمنش و جنایتکار رژیم صهیونیستی، به محضر مبارک فرماندهی معظّم کل قوا( مدظله العالی)، خانواده معزّز ایشان، مردم ولایتمدار و شهید پرور استان اصفهان، فرماندهان سرافراز نیروهای مسلح و سایر رزمندگان و همرزمان عزیز ایشان و خانواده معظم شهداء و ایثارگران، تبریک و تسلیت عرض می نمایم. سردار شهید نیلفروشان که طی بیش از چهار دهه مجاهدت و تلاش مستمر در میدان های دفاع و پاسداری مخلصانه از انقلاب و نظام مقدّس جمهوری اسلامی ایران در برابر دشمنی ها و کینه توزی های دشمنان قسم خورده اسلام، همواره در آرزوی شهادت بود و در این راه سر از پای نمی شناخت، در نهایت در جوار رهبر شجاع و دبیر کل شهید حزب الله، در حین مأموریت مستشاری و دفاع از مردم مظلوم لبنان و  فلسطین به دست شقی ترین دشمنان اسلام و انسانیت، به فیض عظمای شهادت نائل گردید و به آرزوی دیرینه خود رسید. مجاهدت ها و تلاش های ارزشمند سردار نیلفروشان طی چند دهه پاسداری بی وقفه از انقلاب و نظام مقدّس اسلامی در مسئولیت های مختلف راهبردی و مأموریت های گوناگون و حساّس در سپاه و محور مقاومت که همواره منشأ پیشرفت و موفقیّت های چشمگیری در جبهه های و عرصه های مختلف بود،بی تردید ره توشه ای گرانسنگ و قرین اجر اخروی و کسب رضایت پروردگار متعال برای آن شهید سعید است که آثار و برکات آن مجاهدت ها تا سال ها موجب موفقیت و پیشرفت رزمندگان اسلام بوده، هیچگاه از اذهان فرماندهان و همرزمان ایشان فراموش نخواهد شد. اینجانب ضمن ابراز تأسّف و تألم فراوان از شهادت فرمانده پیشکسوت و جانباز دوران دفاع مقدس، سردار شهید، برادر عباس نیلفروشان، شهادت آن برادر مخلص را به محضر مبارک فرمانده معظّم کلّ قوا(مدظله العالی)، خانواده معزّز ایشان و سایر شهدا و ایثارگران و فرماندهان و رزمندگان سرافراز اسلام تبریک و تسلیت عرض نموده، علوّ درجات و رحمت واسعه الهی برای آن شهید سعید و پیروزی هر چه سریعتر جبهه مقاومت بر دشمن جنایتکار صهیونیستی از درگاه خداوند متعال مسئلت می نمایم. متن پیام سردار پاکپور برای شهید سید حسن نصرالله به شرح زیر است: بار دیگر عجز و درماندگی رژیم پلید و رو به زوال صهیونیستی در مواجهه و رویارویی مستقیم با رزمندگان شجاع جبهه مقاومت، پرده از چهره سفّاک این دشمن غدّار و ضدّ بشری برداشت و در هماهنگی با اربابان خود و سکوت همه مدعیان دروغین حقوق بشر، در کمال قساوت و ددمنشی، تعداد دیگری از بهترین فرزندان اسلام و مجاهدین راه حق را به خاک و خون کشید و در رأس آنان، سید مقاومت و مجاهد شهید، آقای سید حسن نصرالله، رهبر محبوب و دبیر کل شجاع، نستوه و ولایتمدار حزب الله لبنان را که بیش از سه دهه از عمر پر برکت خود را در تبعیت از مرجع عالیقدر جهان اسلام و رهبر فقید انقلاب اسلامی، حضرت امام خمینی(ره)و نیز تحت رهنمود های حکیمانه رهبر معظم انقلاب اسلامی ایران در میادین مبارزه و جهاد فی سبیل الله و دفاع از مردم مظلوم فلسطین و ملت شریف لبنان در برابر دشمنان قسم خورده اسلام سپری نموده بود، جمعه گذشته، با استفاده از سلاح های اهدایی آمریکای جنایتکار و با یورشی وحشیانه، به شهادت رساند. شهید سید حسن نصرالله که در سایه ایمان و تدبیر، درایت سیاسی، نبوغ فرماندهی، کلام نافذ و شخصیت معنوی خود طی بیش از سی سال رهبری شجاعانه حزب الله لبنان، با جذب و سامان بخشی به نیروهای جوان و جهادی و با بسیج ظرفیت های مادی و معنوی، نیرویی عظیم و مجهز با آمادگی های دفاعی و معنوی کم نظیری پدید آورده، در برهه ها و مقاطع گوناگون توانسته بود در سایه ایمان، شهادت طلبی و اتکال فرماندهان و نیروهای مخلص حزب الله به قدرت لایزال الهی، بار ها و بارها طعم تلخ شکست و زبونی را به دشمن اشغالگر بچشاند و با به ارمغان آوردن فتح و پیروزی های عظیم بر رژیم اشغالگر صهیونیستی، افسانه شکست ناپذیری آن رژیم را پایان بخشد، همواره همچون خورشیدی فروزان، هادی و راهنمای  رزمندگان محور مقاومت و خاری برچشمان دشمنان کودک کش و متجاوز صهیونیستی و حامیان او بود. بی تردید خون پاک این مجاهد خستگی ناپذیر و شهید والا مقام و سایر شهدای مظلوم لبنان و فلسطین، اراده ملت های حق طلب و امت خداجوی جهان اسلام و رزمندگان دلیر جبهه مقاومت را در ادامه مبارزه  بی امان با صهیونیست های جنایتکار و حامیان آن ها راسخ تر و مصمم تر خواهد نمود. اینجانب با قلبی آکنده از غم و اندوه، شهادت پرافتخار رهبر و دبیر کل مجاهد حزب الله، شهید والامقام، جناب آقای سید حسن نصرالله را به محضر مبارک حضرت ولی عصر(عج)، مقام معظم رهبری(مدظله العالی)، پدر بزرگوار، همسر صبور و خانواده معظّم آن شهید عزیز و رزمندگان پر افتخار جبهه مقاومت و مردم شجاع و قدر شناس لبنان سرافراز و سایر کشورهای اسلامی تبریک و تسلیت عرض نموده، علوّ درجات همه شهدای گرانقدر و شکیبایی و سلامتی تمامی خانواده های معظم شهدا را از درگاه خداوند متعال مسئلت می نمایم. انتهای پیام/
3168539,شهید نیلفروشان یکی از فرماندهان فهیم و شجاع سپاه بود,۰۹ مهر ۱۴۰۳ - ۱۱:۱۱,https://newsmedia.tasnimnews.com/Tasnim/Uploaded/Image/1401/02/29/1401022914450365925353694.jpg,به گزارش گروه دفاعیخبرگزاری تسنیم،‌ سرلشکر حسین سلامی فرمانده کل سپاه پاسداران انقلاب اسلامی به همراه هیئت رئیسه سپاه و فرماندهان نیروها با حضور در منزل سردار نیلفروشان شهادت وی را به خانواده این شهد تبریک و تسلیت گفت. سردار سلامی در این دیدار  گفت: شهید حاج عباس نیلفروشان یکی از فرماندهان بسیار قوی‌دل، مطمئن، آرام، نجیب، فهیم، با شخصیت، مدیر، مدبر و بسیار شجاع و آرام بود. سرلشکر سلامی با اشاره به آشنایی و دوستی دیرینه خود با سردار نیلفروشان افزود: بنده تقریباً بیش از 30 سال است که با او آشنایی دارم و در 6 سال اخیر بسیار نزدیک با حاج عباس مأنوس بودم.  وی ادامه داد: البته برادرانی که امروز اینجا تشریف دارند و از فرماندهان عالی‌مقام سپاه هستند همه به زیبایی شخصیت برادر عزیزمان حاج عباس را می‌شناسند. فرمانده کل سپاه پاسداران تأکید کرد: او یک انسان واقعی بود و شخصیت کاملاً واضحی داشت. آنچه خداوند برای او مقدر کرده بود، این بود که عمر نورانی و با برکت او به شهادت ختم شود. سرلشکر سلامی در ادامه، شهادت در کنار سید حسن نصرالله را یک فضیلت برای سردار نیلفروشان دانست و افزود: بودن کنار سید حسن نصرالله و شهادت در کنار او فضیلت می‌خواهد و انسان با گذر زمان متوجه می‌شود که او با چه افرادی زندگی می‌کرد.بنده معتقد هستم هر فرد با صفت ابدی خود زندگی می‌کند و با همان صفت پای به دنیا می‌گذارد. به نحوی که وقتی یک انسان به شهادت می‌رسد، در واقع او شهید به دنیا آمده، در دنیا شهید زیسته و حیات دارد و سپس به دنیای باقی می‌رود. فرمانده کل سپاه پاسداران با اشاره به دیدارهای روزانه خود با سردار عباس نیلفروشان تصریح کرد: ما هر روز یکدیگر را ملاقات می‌کردیم و گفت‌وگو داشتیم. او بسیار ثابت‌قدم و باروحیه بود و هیچ آثاری از اضطراب در سختی‌ها در سیمای او مشاهده نمی‌شد. شهادت این عزیزان (سید حسن نصرالله و نیلفروشان) تغییر و تحول تاریخی را در جهان اسلام ایجاد خواهد کرد. این خون‌ها بسیار گران‌بها و با ارزش هستند که روی زمین ریخته شده و شهادت بهترین تقدیر و سرنوشتی بود که می‌توانست برای سردار نیلفروشان اتفاق بیفتد. سرلشکر سلامی اظهار داشت:  مطابق آیات قرآن بالاتر از شهادت درجه‌ای وجود ندارد و شهدا از اینکه خداوند چنین موهبتی به آن‌ها داده، شادمان هستند.وی در پایان با بیان اینکه با استعانت از روح همه این شهدا راه آن‌ها را ادامه خواهیم داد خاطرنشان کرد: امروز چشمان ملت ایران در رثای این شهدا اشک‌بار و قلب‌ها نیز غمگین است. انتهای پیام/
3168541,سردار فرحی معاون امور صنعتی و تحقیقاتی وزارت دفاع شد,۰۹ مهر ۱۴۰۳ - ۱۰:۵۴,https://newsmedia.tasnimnews.com/Tasnim/Uploaded/Image/1402/09/12/140209121700077928897304.jpg,به گزارش خبرنگار دفاعیخبرگزاری تسنیم، سردار سیدمهدی فرحی با حکم امیر نصیرزاده وزیر دفاع و پشتیبانی نیرو‌های مسلح بعنوان معاون امور صنعتی و تحقیقاتی وزارت دفاع کشور منصوب شد. پیش از این افشین نادری شریف عهده‌دار معاونت امور صنعتی و تحقیقاتی وزارت دفاع و پشتیبانی نیروهای مسلح بود. سردار فرحی پیش از این و در بهمن‌ماه 1402 طی حکمی از سوی وزیر صنعت، معدن و تجارت، به‌عنوان قائم مقام وزیر صمت در امور بازرگانی منصوب شده بود. وی پیش از آن و از شهریورماه 1400 با موافقت مقام معظم فرماندهی کل قوا و با حکم وزیر وقت دفاع به عنوان جانشین وزیر دفاع و پشتیبانی نیروهای مسلح منصوب شده بود. سیدمهدی فرحی عضو هیأت علمی دانشگاه صنعتی مالک اشتر و از دیگر سوابق وی در وزارت دفاع می‌توان به رئیس سازمان پژوهش و نوآوری دفاعی، معاون آماد و تحقیقات، معاون امور صنعتی و تحقیقاتی، رئیس سازمان صنایع هوافضا و مدیرعامل سازمان صنایع دفاع اشاره کرد. انتهای پیام/
3168502,شهید نیلفروشان در سنگر مستشاری نظامی جبهه مقاومت درخشید,۰۹ مهر ۱۴۰۳ - ۱۰:۲۳,https://newsmedia.tasnimnews.com/Tasnim/Uploaded/Image/1402/07/16/1402071613372583828519384.jpg,"به گزارش گروه دفاعیخبرگزاری تسنیم، سردار سرلشکر محمد باقری رئیس ستادکل نیروهای مسلح در پیامی شهادت سردار نیلفروشان در ضاحیه بیروت را تسلیت گفت. متن این پیام به‌شرح ذیل است: بسم اللّه الرّحمن الرّحیممِنَ الْمُؤْمِنِینَ رِجَالٌ صَدَقُوا مَا عَاهَدُوا اللَّهَ عَلَیْهِ فَمِنْهُمْ مَنْ قَضَی نَحْبَهُ وَمِنْهُمْ مَنْ یَنْتَظِرُ وَمَابَدَّلُوا تَبْدِیلًا شهادت پرافتخار سردار عالی‌قدر و دانشمند سپاه اسلام ""سرتیپ پاسدار عباس نیلفروشان"" مستشار عالی نظامی جمهوری اسلامی ایران در لبنان را، که همراه رهبر مقتدر مقاومت، دبیرکل مجاهد حزب‌الله ""حجت الاسلام والمسلمین شهید سید حسن نصرالله"" و به‌دست پلید جنایتکاران صهیونیست به فیض والای شهادت نائل شد، به مقام معظم رهبری و فرمانده‌کل قوا (مدّ ظلّه العالی)، خانواده معظم شهید و آحاد همرزمان ایشان در جبهه مقاومت اسلامی به‌ویژه نهاد مقدس ""سپاه پاسداران انقلاب اسلامی"" تبریک و تسلیت عرض می‌نمایم. نقش‌آفرینی‌های مؤثر و راهگشای شهید نیلفروشان برای همیشه ماندگار و یاری‌بخش ادامه‌دهندگان راهش در نیروهای مسلح و مدافعان امنیت کشور خواهد بود. او عمر بابرکت خود را در مجاهدت و فداکاری در عرصه‌های مختلف انقلاب و نظام اسلامی سپری کرد و پس از شهادت شهید والامقام سرلشکر پاسدار محمدرضا زاهدی میراث‌دار او در سنگر مستشاری نظامی جبهه مقاومت اسلامی شد و در این میدان سترگ هم خوش درخشید. بی‌شک پرچمی که شهدای قدس برای رهایی فلسطین و ملت‌های مسلمان از سلطه استکبار جهانی و صهیونیسم خبیث بین‌الملل به اهتزاز درآورده‌اند با شهادت مجاهدان و فرماندهان مقاومت بر زمین نخواهد ماند، بلکه برافراشته‌تر از قبل کانون آگاهی، بیداری و تقویت روح استکبارستیزی و اقتدار روزافزون سازمان عظیم مقاومت اسلامی خواهد شد. سلام و رحمت خداوند و اولیاء طاهرینش بر این شهید عالی‌قدر و دیگر شهیدان این حادثه، و لعنت و نفرین بر سردمداران رژیم ظالم و متجاوز صهیونی و حامیان پلید و تبهکار آن باد. رئیس ستادکل نیروهای مسلحسرلشکر پاسدار محمد باقریمهرماه 1403 انتهای پیام/+"
3168419,تسلیت سخنگوی دولت در پی شهادت سردار عباس نیلفروشان,۰۹ مهر ۱۴۰۳ - ۰۹:۲۳,https://newsmedia.tasnimnews.com/Tasnim/Uploaded/Image/1403/07/03/1403070315115726231047064.jpg,به گزارش حوزه دولتخبرگزاری تسنیم، فاطمه مهاجرانی سخنگوی دولت به‌مناسبت شهادت سردار سرتیپ پاسدار عباس نیلفروشان معاون عملیات سپاه که در حمله‌ی روز جمعه‌ی رژیم صهیونیستی به بیروت به‌همراه سید حسن نصرالله رهبر حزب‌الله لبنان به شهادت رسید، پیامی تسلیتی صادر کرد. در این پیام آمده است: بسم الله الرحمن الرحیم شهادت سردار رشید سرتیپ پاسدار عباس نیلفروشان فرمانده جان برکف دفاع مقدس و مستشار سپاه پاسداران انقلاب اسلامی در کشور لبنان را که در حمله تروریستی رژیم منحوس صهیونیستی در کنار شهید سرافراز سیدحسن نصرالله به شهادت رسید را محضر مقام معظم رهبری و همرزمان آن شهید بزرگوار و خانواده معظم ایشان و ملت شریف ایران تبریک و تسلیت عرض می‌کنم. انتهای پیام/
3168405,ویترین تسنیم شماره ۷۵۰,۰۹ مهر ۱۴۰۳ - ۰۸:۵۴,https://newsmedia.tasnimnews.com/Tasnim/Uploaded/Image/1400/04/22/1400042215482343123192092.jpg,هر روز بخشی از مهمتریناخبارو گزارش‌های تسنیم را در ویترین تسنیم ببینید: 1- سردار نیلفروشان؛ فرمانده چند وجهی مقاومت که بود؟ 2- سردار وحیدی: همه‌ی فرماندهان ترور شده حزب‌الله جایگزین شدند 3- درباره ترور دبیرکل حزب‌الله در لبنان: متی نصرالله؟ 4- 56 تُن بمب آمریکایی برای ترور نصرالله 5- شهید حسن نصرالله؛ رهبر کاریزماتیک و عامل اتحاد نیروهای مقاومت  انتهای پیام/
3168312,سردار نیلفروشان؛ فرمانده چندوجهی مقاومت که بود؟,۰۸ مهر ۱۴۰۳ - ۲۱:۰۸,https://newsmedia.tasnimnews.com/Tasnim/Uploaded/Image/1403/07/07/1403070717204850831080464.jpg,گروه دفاعیخبرگزاری تسنیم:ششم مهرماه در جریان حمله رژیم صهیونیستی به جنوب لبنان سردار عباس نیلفروشان، یکی از فرماندهان عالی‌رتبه سپاه پاسداران انقلاب اسلامی همراه سید حسن نصرالله به شهادت رسید. سردار نیلفروشان که از فروردین ماه امسال به‌عنوان مستشار ارشد سپاه در لبنان منصوب شده بود، یکی از فرماندهان راهبردی سپاه بود که شناختی دقیق و واقع‌بینانه از رژیم صهیونیستی و توانمندی‌های حزب‌الله داشت. چهار دهه حضور وی در میدان جهاد با استکبار جهانی و همچنین فعالیت علمی تا رتبه دانشیاری در دانشگاه امام حسین(ع)، شخصیتی راهبردی با قدرت تحلیل دقیق و مبتنی بر واقعیت از سردار نیلفروشان ساخته بود که موجب می‌شد در هر مسئولیتی قرار بگیرد منشأ اثرات مختلفی باشد. سردار پیش از انتصاب به‌عنوان مستشار ارشد ایران در لبنان، در سال 86 نیز به‌عنوان مسئول عملیات سپاه در لبنان منصوب شده بود. وی مجدداً در سال 93 و در اوج مقابله با فتنه تکفیری‌ها در سوریه به همین سمت منصوب شد و فعالیت مستقیم در این حوزه تجربه‌ای گرانبها در اختیار وی قرار داده بود،علاوه بر این وی زمانی مسئول عملیات نیروی زمینی سپاه بود که آمریکا افغانستان و عراق را اشغال کرده بود و کشورمان هم در معرض تهدید جدی قرار داشت. تجربه مقابله با آمریکا، رژیم صهیونیستی و تروریست‌های تکفیری و سوابق علمی درخشان، فرماندهی چندوجهی از سردار نیلفروشان ساخته بود که بخشی از اثرات فرماندهی وی در تقویت یگان‌های ضدزره و همچنین تشکیل یگان رضوان حزب‌الله نمایان شد. از آخرین اقدامات وی در زمان فعالیت مستشاری در لبنان می‌توان به عملیات اربعین حزب‌الله لبنان اشاره کرد که سردار نیلفروشان به‌عنوان مستشار در جریان طراحی و اجرای آن نقش داشت. این عملیات ضربه مهلکی بر پیکره دستگاه اطلاعاتی ارتش اسراییل و یگان 8200 آن وارد کرد. یکی دیگر از ابتکارات موفق سردار نیلفروشان تشکیل قرارگاه نبی اکرم(ص) به‌عنوان مرکز فرماندهی و کنترل برخط و یکپارچه عملیات‌های سپاه بود که برکات آن در عملیات بزرگ وعده صادق به‌خوبی نمایان شد. نقشه ترور سردار نیلفروشان اما به سال 1401 برمی‌‌گردد، زمانی که وی به‌عنوان مسئول عملیات کل سپاه با قدرت فرماندهی و حضور میدانی خود مانع از تحقق نقشه‌های تجزیه‌طلبانه دشمن شد،این موضوع کنار سایر ضرباتی که با طراحی او بر پیکره آمریکا و رژیم صهیونیستی وارد شده بود، موجب شد در سال 1401 در لیست ترور آمریکایی‌ها قرار بگیرد و از آن زمان بود که موضوع ترور وی در دستور کار سرویس‌های اطلاعاتی دشمن قرار گرفت. اما اقدامات سردار نیلفروشان تنها به حوزه دفاعی و امنیتی ختم نمی‌شود و به حوزه‌های غیرنظامی هم تسرّی پیدا می‌کند که از جمله آنها می‌توان به کمک به مستضعفان و محرومان اشاره کرد. 10 فروردین ماه 1399 و درست در اوج همه‌گیری کرونا از ساعت 6 صبح تا 3 بعدازظهر را به سرکشی از حوزه مقاومت بسیج 101 فجر در تهران اختصاص داد، در جریان این سرکشی بود که متوجه شد برخی افراد ساکن در این منطقه فاقد منزل مناسب هستند و توانایی تهیه مسکن ندارند. پس از آن به‌سرعت دست‌به‌کار شد تا پیش از فرارسیدن فصل سرما برای این افراد سرپناه مناسبی تهیه کند، با رایزنی با یکی از افراد خیّر وجه احداث هشت باب منزل مسکونی را تهیه کرد و با کمک بسیجیان این منطقه توانست برای این افراد مسکن مناسب تهیه کند، یا در مورد دیگری زمانی که متوجه شد گروهی از خانواده‌های شهدای فاطمیون برای برگزاری مراسم افطاری در ماه رمضان دچار مشکل مالی هستند تمام هزینه‌های آن را به‌عهده گرفت. انتهای پیام/+
